name,sub_name,score,price,labels,introduction,address
雲南小鍋米線,Yunnan Noodle,4,$50以下,滇菜 (雲南)/粉麵/米線,,葵涌梨木道112號葵寶大廈地下5號舖
川味雞烤魚大王,Monster Spicy,4,$101-200,川菜 (四川)/火鍋/中菜館,正宗重慶美食及火鍋專門店，香料由重慶直送，烤魚、藥膳雞煲及麻辣小菜均有水準。,荃灣大河道91號天保大廈地下F1號舖
尚點 小籠包.上海菜館,Shouten Shanghai Noodle House,4,$51-100,滬菜 (上海)/點心/雲吞/餃子/中菜館,以優質上海菜式為賣點，主要提供點心及麵食，既保持傳統上海風味，同時加入創新賣相及組合；以精湛、巧妙的手藝自創多款特色上海菜。,荃灣荃華街3號悅來坊2樓201號舖
春風撞奶舖,Chun Feng Milk House,3.5,$50以下,台灣菜/台式飲品,,元朗鳳琴街15號鴻運中心地下74A號舖
湘川滬,China Land Restaurant,4,$101-200,川菜 (四川)/滬菜 (上海)/湘菜 (湖南)/中菜館,,粉嶺新運路33號粉嶺中心1樓212A號舖
金香緣雲南過橋米線,JinXiang Yuan Yunnan Ricenoodle,4,$50以下,滇菜 (雲南)/粉麵/米線,,荃灣沙咀道341號華興樓地下
莆田,PUTIEN,3.5,$101-200,閩菜 (福建)/海鮮/山珍海味/中菜館,,馬鞍山鞍祿街18號MOSTown新港城中心(4期)2樓2105號舖
容龍海鮮酒家,Dragon Inn Seafood Restaurant,3.5,$201-400,粵菜 (廣東)/海鮮/海鮮酒家,於1939年開業，位置接近屯門三聖邨，可自攜海鮮加工。,屯門青山公路19咪半
澳門街水蟹粥雞湯米,Pho Real Macau Street Water Crab Porridge Chicken Noodles,3.5,$50以下,粵菜 (廣東)/粉麵/米線/湯品/粥品,澳門街頭風味的小店，專門售賣澳門特色食品，如水蟹粥、雞湯米。,元朗鳳攸南街3號好順景大廈地下2座地下18號舖
喜茶,HEYTEA,4,$50以下,粵菜 (廣東),用現代的設計語言重構“遊廊”形態，在喜茶沙田新城市廣場店，茶客如同遊人穿過圓門、拱橋、園林，獲得別樣的飲茶趣味。,沙田沙田正街18號新城市廣場1期4樓408號舖
新斗記,Xin Dau Ji,3.5,$201-400,粵菜 (廣東)/燒臘/中菜館,,荃灣大壩街4-30號荃灣廣場6樓615-620號舖
嘉麗園潮州粉麵餐廳,Ka Lai Yuen Chiu Chow Restaurant,3.5,$50以下,潮州菜/粉麵/米線/中菜館,,元朗康景街利景樓5號地下
茶煲,Tea Pot,4,$101-200,粵菜 (廣東)/港式/火鍋/點心/雞煲,,將軍澳寶琳北路18號寶林商場3樓1C號舖
彩龍茶樓,Choi Lung Restaurant,3,$51-100,粵菜 (廣東)/點心/中菜館/酒樓,,荃灣荃錦公路川龍村2號
南記海鮮飯店,Nam Kee Restaurant,3.5,$201-400,粵菜 (廣東)/海鮮/大牌檔/咪嘥嘢食店,舊式大排檔風味，自選烹調法。,屯門三聖邨食亭地下1-4號舖
鳳城皇宴,Fung Shing Restaurant,4,$51-100,粵菜 (廣東)/港式/燒臘/點心/酒樓,,屯門海珠路2號地下1-3號舖
勝利牛丸,Victory Beef Ball,3,$50以下,粵菜 (廣東)/粉麵/米線,,元朗谷亭街傑文樓地下1號舖
利苑酒家,Lei Garden,3.5,$201-400,粵菜 (廣東)/點心/酒樓,利苑酒家提供大量套餐，當中有鮑魚﹑響螺﹑燕窩等菜式。酒家不斷創新以迎合客人的需求及時代的轉變，保持現有菜式的水準，並因應客人的口味加以改良及鑽研新菜，30年來創出上千款菜式。,沙田沙田正街18號新城市廣場一期6樓628 &631
殷悅,YinYue,3.5,$101-200,粵菜 (廣東)/點心/中菜館/酒店餐廳,位於悅來酒店三十樓的殷悅中菜廳，居高臨下，擁有開揚豁然的景致，環境舒適。為配合現代人注重健康的要求，所有食品均不添加味精，盡顯大廚心思。,荃灣荃華街3號悅來酒店30樓
利小館,Lei Bistro,3.5,$101-200,粵菜 (廣東)/海鮮/點心/中菜館,"細味利品, 品味人生
秉承利苑飲食集團「利人利己」的理念，將完美飲食文化注入生活的獨特小館概念—「利小館」。結集品質、創意與健康元素，細心選用優質食材，用心研發獨家烹調方法。煥然一新的室內設計概念，令人耳目一新, 我們希望客人都能在這裏享受到利小館的「利品生活」。",屯門屯門鄉事會路83號V City商場MTR層37號舖
民華魚蛋粉麵,Man Wah Fish Ball Noodle,3.5,$50以下,潮州菜/粉麵/米線/茶餐廳/冰室,,大埔廣福里19號地下C舖
屋子咖啡,Uchi Coffee,3.5,$51-100,日本菜/甜品/糖水/咖啡店,以木為主題的裝潢，白色牆身掛上懷舊日式海報，一角還有寄賣的香港及台灣設計師手作作品。餐廳提供的菜式混合台式及日式風格，賣相精緻。,大圍積信街49號安信樓地下P號舖
元札幌拉麵,Sapporo Ramen En,4,$51-100,日本菜/拉麵/雲吞/餃子,,荃灣荃華街3號悅來坊B1樓B121號舖
鮨亭,Sushi Tei,4,$101-200,日本菜/壽司/刺身,,屯門青善街22號康景花園地下3-4號舖
麵道,Ramen Dou,4,$51-100,日本菜/拉麵,以京都濃郁湯底為主打的拉麵店，裝修極具日本風格，以龍蝦熬成的伊勢海老豚骨湯最受歡迎。,荃灣眾安街68號千色匯I期2樓2031號舖
爆丼丼,,3.5,$101-200,日本菜/壽司/刺身/烏冬,主打刺身丼飯。四重爆丼可以一次過品嚐海膽、吞拿魚蓉、帆立貝、三文魚籽等，份量十足。熱食亦有肉類、鰻魚可選。,荃灣河背街74號地舖
L.D.K. by Ufufu Café,,4,$101-200,日本菜,來自日本九州的日式cafe，主打各式芭菲如心太軟抹茶芭菲、焦糖燒香蕉朱古力芭菲及靜岡蜜瓜芭菲等。餐廳亦提供意粉、漢堡扒及蛋包飯等鹹食。,沙田沙田正街18號新城市廣場一期1樓115號舖
霸嗎拉麵,Ramen Bari-Uma,3.5,$51-100,日本菜/拉麵,,屯門屯順街1號屯門市廣場1期3樓3233號舖
小越廚,Le Saigon Cuisine,4,$50以下,越南菜/粉麵/米線,,荃灣享和街49號都城大廈地下D舖
屋子生活,Uchi Coffee,3.5,$51-100,日本菜/咖啡店,文青系café，樓底高，有坐地榻榻米座位可選，絕對可以一忘煩囂的生活。除咖啡、甜點，亦有正餐提供。,馬鞍山烏溪沙路8號迎海薈地下4A舖
札幌拉麵 Miso No.1,Sapporo Ramen Miso No.1,3.5,$51-100,日本菜/拉麵,,荃灣楊屋道18號荃新天地二期UG59號舖
Mimila,,4,$101-200,馬來西亞菜/粉麵/米線,,沙田沙田正街18號新城市廣場1期7樓704號舖
酩鬼居酒屋,,4,$201-400,日本菜/居酒屋,充滿日本和式風格。有榻榻米座位、吧檯等選擇。店家貼心附上居酒屋的點菜次序，先選酒，後吃佐酒菜及主食，有不少自家製酒可嘗。,元朗馬田路14-18號京華閣地下16B號舖
Mee...lemongrass,,4,$51-100,泰國菜/馬來西亞菜/咖喱/串燒/沙律,,將軍澳坑口重華路8號東港城2樓238號舖
韓舍,,3.5,$101-200,韓國菜/烤肉/自助餐,,元朗馬田路80號御庭居購物商場地下6-7號舖
玉子造屋,Egg Factory,4,$51-100,日本菜,,將軍澳唐德街9號將軍澳中心地下B03C號舖
貓澳,Meow,3,$51-100,港式/西式/咖啡店,,大澳吉慶街67號地下
Ritz Bar & Cafe,,3.5,$201-400,意大利菜/西式/西餐廳,,赤鱲角香港國際機場二號客運大樓6樓6P032號舖(非禁區)
LaLa mama's,,4.5,$51-100,西式/麵包店/露天茶座,,南丫島沙埔舊村27號地下
一家大細,WSYZ Cafe,4,$51-100,西式/甜品/糖水/漢堡包/咖啡店,,長洲新興海傍街57號地下
Lamma Grill,,4,$51-100,美國菜/漢堡包/外賣店,,南丫島榕樹灣大園村18E號舖
ChocoDuck Bistro,,4,$101-200,意大利菜/西式/西餐廳/咖啡店,,長洲建新里3號地下
The Kitchen,,4,$51-100,意大利菜/薄餅/西餐廳,,大嶼山梅窩碼頭路18A卓濤軒地下1號舖
星巴克咖啡,Starbucks Coffee,3.5,$50以下,美國菜/沙律/西式糕點 /咖啡店,,東涌達東路20號東薈城名店倉地下G19號舖
Joe & The Juice,,3.5,$50以下,西式/果汁/咖啡店,,赤鱲角香港國際機場一號客運大樓6樓離港層中央客運廊6Z511號舖(禁區)
一刻館,Java+,,$51-100,西式/麵包店/甜品/糖水/咖啡店,咖啡店設有外賣服務，無論是早餐自取，抑或在店內悠閒地喝咖啡和看書，盡是極樂享受。,赤鱲角香港國際機場航天城東路1號香港天際萬豪酒店大堂
酒廊,The Lounge,4,$101-200,西式/酒吧/酒店餐廳,位於酒店的中心位置，坐擁南中國海的浩瀚景色，為客人提供鬆弛身心的好去處。該處適合舉行非正式會議或三五知己暢聚。,赤鱲角香港國際機場航天城東路1號香港天際萬豪酒店大堂
Uncle Russ fresh Roasted,,,$51-100,西式/咖啡店,,愉景灣愉景廣場地下G40B號舖
水牛自釀啤酒吧,The Water Buffalo British Restaurant & Brewpub,4,$101-200,英國菜/西餐廳/酒吧,,大嶼山貝澳老圍村13號地下
Pret A Manger,,3.5,$51-100,英國菜/三文治/咖啡店,,東涌達東路20號東薈城名店倉地下G18號舖
Godiva Chocolatier,,4,$51-100,西式/朱古力/糖果店,,赤鱲角香港國際機場一號客運大樓5樓抵港層接機大堂 (非禁區)
孔敬泰國餐廳,Khon Kaen Thai Restaurant,4.5,$101-200,泰國菜/咖喱,,長洲建新里6號地舖
La Creation & Châteraisé,,3.5,$50以下,日本菜/麵包店/西式糕點,,愉景灣D'Deck 地下G05號舖
Pepper Lunch Express,,3.5,$51-100,日本菜/Food Court,,赤鱲角香港國際機場二號客運大樓翔天廊6樓(非禁區)
Kebab Korner,,3,$51-100,印度菜/土耳其菜/咖喱/快餐店,,大嶼山梅窩銀運路1號海景大廈地下F舖
漢那厨房,Kanna's Kitchen,4,$50以下,日本菜,,長洲建新里5號地下
Kimos Turkish and Indian Cuisine,,3,$101-200,印度菜/土耳其菜/咖喱/清真認證食品/外賣店/西餐廳,,東涌海濱路8號海堤灣畔商場地下L舖
Dosirak House,,3.5,$51-100,韓國菜,由同區居住的韓籍夫婦主理的韓式外賣店，還備有小量韓式小吃和糧食售賣。,東涌健東路1號映灣園商場6B號舖
泰興隆泰國菜館,Chok Dee Thai Food,4.5,$101-200,泰國菜,環境悠閒的泰菜館，推介香草炸魚、椰汁雞湯和各式串燒。,坪洲坪洲永安街40號後座地下
舊街場白咖啡,Old Town White Coffee,,$51-100,新加坡菜/馬來西亞菜/咖啡店,,赤鱲角香港國際機場一號客運大樓6樓離港層西大堂食東西(禁區)
味千拉麵,Ajisen Ramen,3,$51-100,日本菜/拉麵,味千拉麵店始創於1968年，發源地日本九州的熊本。,赤鱲角香港國際機場中場客運廊7樓 (禁區)
泰風味,Sawasdee Thai,3,$50以下,泰國菜/快餐店,,赤鱲角香港國際機場二號客運大樓翔天廊6樓美食廣場(非禁區)
逸東泰國小食,,,$50以下,泰國菜,,東涌逸東街8號逸東商場地下香港街市99號舖
七月日本料理,July Japanese Resturant,3,$101-200,日本菜/壽司/刺身/烏冬/居酒屋,,長洲大新後街141號地下
青悅·越泰料理,Lime Garden,4,$51-100,越南菜/泰國菜,,赤鱲角香港國際機場機場一號客運大樓 (非禁區) 8樓離港層8T011-012號舖
夏雪,Summer Ice,4,$51-100,西式/甜品/糖水/雪糕/乳酪/咖啡店,主打賣相討好的紫薯及抹茶甜品，如紫薯窩夫、抹茶affogato及芭菲等。,西環堅尼地城厚和街6-18號滿發大廈地下D舖
Oggi,,4,$101-200,意大利菜/西式/多國菜,,天后水星街9號地下B舖
BRICK LANE,,4,$101-200,英國菜/甜品/糖水/無肉餐單/All Day Breakfast/咖啡店/酒吧,BRICK LANE 主打英式全日早餐及班尼迪蛋，亦備一系列英國地道菜餚，包括自家餅房出品的紅絲絨蛋糕。餐廳設計裝潢型格，概念以倫敦東部Brick Lane 為藍本。在磚牆上掛着白色單車，工業風加上黑木布置及古式燈泡，極具英國美食酒館風。,金鐘添美道1號中信大廈4樓404號舖
Casa Pennington,,4,$401-800,西式/酒/海鮮/蠔吧,,銅鑼灣邊寧頓街13-15號隆堡柏寧頓酒店三樓
Lex Coffee,,4,$101-200,西式/咖啡店,樓底四米高的Cafe，加上有開放式天台，空間感十足。餐廳裝修優雅，採用自助形式。以甜品、意粉及All Day Breakfast為主，飲品則以餐廳為名的Lex Drink最有特色。,西環堅尼地城卑路乍街100號地舖
Tartes & Pop,,4.5,$50以下,法國菜/西式糕點 /朱古力/糖果店,,上環摩利臣街2號地舖
意粉狂熱,Pastaholic,4,$101-200,意大利菜/薄餅,,銅鑼灣告士打道311號皇室堡2樓203-204號舖
Green Waffle Diner,,4,$101-200,西式/美國菜/甜品/糖水/All Day Breakfast/咖啡店,,中環嘉咸街35-39號嘉豪大廈地舖
OVOCAFE,,3.5,$101-200,西式/素食/咖啡店,OVOCAFE是健康素食餐廳，菜式夠light夠健康。店內佈置得像花園一樣，落足心思。,灣仔灣仔道1號地下 (灣仔舊街市內)
FRITES Belgium on Tap,,4,$201-400,比利時菜,,中環威靈頓街198號The Wellington 1樓
Brunch Club & Supper,,3.5,$101-200,英國菜/All Day Breakfast,全天候供應Brunch的餐廳，位置靜中帶旺，而且環境寬闊，裝修走歐陸風，氣氛熱鬧，適合任何時間享受一個悠閒的Brunch或英式早餐。另外，餐廳亦有供應豐富菜式如雜扒和其他肉類。,銅鑼灣禮頓道13號1樓
Season Oyster & Wine Bar,,4,$101-200,西式/酒/海鮮/酒吧/蠔吧,位於銅鑼灣及天后中間的蠔吧，每月都會推出不同的優惠，生蠔以外亦有各種海鮮及海膽多士等，另設酒水配蠔。,銅鑼灣信德街14號地舖
Oldish,,4,$101-200,英國菜/All Day Breakfast/主題餐廳,裝修復古、於人舒服感覺的咖啡輕食店，推薦芝士和牛漢堡。,上環東街53號地舖
Pici,,4,$201-400,意大利菜,主打每日供應新鮮手製意大利麵，利用時令食材創作不同菜式，並將地道的意式風味帶到香港。餐廳氣氛舒適輕鬆，更可用美酒配搭意大利麵。,灣仔進教圍16號地舖
小島•澳門菜,Cafe Terceira,4,$101-200,葡國菜,,銅鑼灣勿地臣街1號時代廣場13樓1302號舖
三星台菜食堂,Tristar Kitchen,3.5,$101-200,台灣菜/名人店,歌手藝人傅珮嘉開設的台菜餐廳，由台灣人大廚主理。主打地道台灣菜，招牌三星牛肉麵內有牛肚、牛腩及牛根。也有提供甜不辣及鹽酥雞等小食。,銅鑼灣駱克道459-461號 The L. Square 21樓
上海弄堂菜肉餛飩,Shanghai Lane,4,$51-100,滬菜 (上海)/無肉餐單/中菜館/咪嘥嘢食店,位於中環蘇豪區的滬菜餐廳，裝修風格散發老上海復古氣息，寬敞舒服。除了必點的菜肉餛飩，小籠包、酸辣湯、花雕醉雞、排骨擔擔麵、香菇烤麩及菜飯也在水準之上。,中環歌賦街35-37號地舖
湘聚小廚,Jiang's Hunan chef,4,$51-100,湘菜 (湖南)/中菜館,以湘菜為主食的餐廳，大廚來自湖南，烹調手法正宗，大部分的菜式均為辣食，但亦有不辣的小炒菜。,西環日富里13號富基大廈地舖
台灣郎,Taiwan Lang,4,$51-100,台灣菜,,天后銀幕街21號地下及1樓
8鍋臭臭鍋,8Pots HK,4,$101-200,台灣菜/火鍋,來自台灣的台式火鍋專門店，有多款不同湯底，大部分食材均由台灣入口。除招牌臭臭鍋外，亦有芝士牛奶鍋及臺式麻辣鍋，全部皆以一人一鍋形式供應。,銅鑼灣謝斐道440號駱克大廈A座地下E舖
京.花朝,Fat Duck Den Chinese Cuisine,4,$101-200,京菜 (官府菜)/滬菜 (上海)/中菜館,,銅鑼灣耀華街3號百樂中心9樓
王家沙花樣年華,Wang Jia Sha,4,$101-200,滬菜 (上海)/中菜館,,銅鑼灣登龍街1-29號金朝陽中心2期Midtown 1樓
至尊重慶雞煲,Supreme Restaurant,4,$101-200,川菜 (四川)/火鍋/雞煲,,銅鑼灣堅拿道西10號冠景樓2樓B舖（鵝頸橋底）
珍煮丹,,4,$50以下,台灣菜/台式飲品/少鹽少糖食店,,銅鑼灣利園山道15號地舖
湘蜀人家,Xiangshu Restaurant,4,$101-200,川菜 (四川)/湘菜 (湖南)/中菜館,主打湘菜及川菜兩大菜系，由四川廚師主理，招牌菜式包括自製川北涼粉、擔擔麵及水煮魚。菜式辣度勁，用上多款辣椒製作，口味正宗。,灣仔莊士敦道181號大有廣場2樓218號舖
大官廳,Tycoon Tann,4,$401-800,粵菜 (廣東)/中菜館,,中環威靈頓街74號明發大廈地下至2樓
何洪記,Ho Hung Kee,3.5,$51-100,粵菜 (廣東)/粉麵/米線/粥品,餐廳招牌菜為粥、粉、麵，其中招牌雲吞麵除了味道好外，同時滲透著老香港的風味。,銅鑼灣軒尼詩道500號希慎廣場12樓1204-1205號舖
鍾廚,Chung's Kitchen,3.5,$101-200,粵菜 (廣東)/點心/中菜館/少鹽少糖食店,以細膩而新穎的手法重新演繹以粵菜為主、北方菜式為輔的家鄉菜餚，既有鮑參翅肚等宴客菜式，亦有家常小菜，分店免茶芥及加一服務費。,銅鑼灣勿地臣街1號時代廣場12樓1201號舖
龍景軒,Lung King Heen,4,$801以上,粵菜 (廣東)/Fine Dining/中菜館/酒店餐廳,龍景軒位於酒店4樓，坐擁九龍半島壯麗景色。餐廳的廚師廚藝創新出眾，提供新派高級粵菜，並選用本地新鮮的高級食材入饌。餐廳裝潢獨特，以玻璃屏風、別致的銀箔天花板，襯托璀燦奪目的維多利亞港景色。,中環金融街8號香港四季酒店4樓
六和素食,Veg 6 Vegetarian Restaurant,4,$101-200,粵菜 (廣東)/多國菜/素食/無肉餐單/中菜館,,銅鑼灣堅拿道西10號冠景樓1樓A舖
翠玉軒,The Square,3.5,$201-400,粵菜 (廣東)/點心/酒樓,翠玉軒位處中環交易廣場，環境寬敞舒適，適合舉辦各類型宴會。由獲獎名廚主理的粵菜，深受城中老饕愛戴。,中環干諾道中8號交易廣場第二座4樓401號舖
莊館,John Anthony,3.5,$201-400,粵菜 (廣東)/中菜館/少鹽少糖食店,From the team that brought you Mott 32 - a new concept that pushes the boundaries of culinary innovation and sustainability. Experience John Anthony for yourself on 21st September.,銅鑼灣新寧道1號利園三期B1樓B01-B10號舖
再興燒臘飯店,Joy Hing Roasted Meat,3.5,$51-100,粵菜 (廣東)/燒臘/中菜館,再興自設工場，臘味每日新鮮燒製，招牌的叉燒肉質嫩滑，表面有甜甜的蜜糖味。,灣仔軒尼詩道265-267號地下C座
興中會,Steam,4,$101-200,粵菜 (廣東)/港式/點心/中式包點,,中環士丹頓街11號地下
鴨大哥,Forbidden Duck,3.5,$201-400,粵菜 (廣東)/少鹽少糖食店,,銅鑼灣勿地臣街1號時代廣場10樓1001B號舖
百樂潮州酒樓,Pak Loh Chiu Chow Restaurant,3.5,$401-800,潮州菜/海鮮/點心/中菜館/酒樓,百樂酒樓是以潮式食品為主打，包括滷水鵝片及凍蟹為招牌菜。,銅鑼灣希慎道23-25號地下
棋哥燒鵝餐室,Ki’s Roasted Goose Restaurant,3.5,$51-100,粵菜 (廣東)/港式/燒臘,,灣仔軒尼詩道423-425號嘉年華商業大廈地舖
彩福喜宴,Choi Fook Delight Banquet,3.5,$101-200,粵菜 (廣東)/海鮮/點心/酒樓,,北角英皇道255號國都廣場3樓
嚐館,Taste Restaurant & Bar,4,$201-400,粵菜 (廣東)/火鍋/海鮮/點心/海鮮酒家/咪嘥嘢食店,,灣仔船街1-7號寶業大廈G至1樓
坐忘,Camper's,4,$51-100,日本菜/拉麵/烏冬/無肉餐單,由日本人開設的餐廳，小店主打日式家常菜，堅持無味精及多菜少油的原則。,天后電氣道127號地舖
金羅寶韓國料理,Jin Luo Bao Korean Restaurant,4,$101-200,韓國菜/烤肉,,銅鑼灣記利佐治街1號金百利廣場6樓
隨心,With Your Mind,4,$51-100,新加坡菜/馬來西亞菜/海鮮/咖喱/咪嘥嘢食店,主打新加坡菜的小店，推介海鮮喇沙，配料份量多，有蛋、帆立貝、魚片及鮮蝦等，相當足料。,鰂魚涌海光街12號地舖
坐忘,Camper's,4,$51-100,日本菜/拉麵/烏冬/無肉餐單,主廚Fujita Kenta在日本川崎經營「坐忘」17年，烹飪注重無添加、無味精、多蔬菜、少油。本著「美味，健康，良知」的理念，首次在香港開業。此外，餐廳選用的餐具均由無害陶瓷製作。,鰂魚涌濱海街13號中興大廈地下
火山燒,Volcano Grill,3.5,$201-400,日本菜/串燒/日式放題,,銅鑼灣駱克道459-461號 The L. Square 9樓
金田家,Kanada-ya,4,$51-100,日本菜/拉麵,曾被日本搵食網選為2013年最佳食店之一的金田家，是來自日本福岡縣的過江龍。18小時長煮湯底加秘製醬料有別於一般在港吃到的拉麵，叉燒材料更選用沖繩和鹿兒島的豬肉。,銅鑼灣登龍街34號地下
大吉居酒屋,Izakaya Daikichi,3.5,$201-400,日本菜/壽司/刺身/居酒屋,位於2樓的一間日式料理餐廳，面積寬敝，裝修設計很有日本和式風味，店裡食物精緻。,中環威靈頓街52-54號Somptueux Central 2樓
京林屋,Kyo Hayashiya,4,$51-100,日本菜/甜品/糖水,來自京都，有過200年歷史的抹茶老字號，抹茶由總店運來，用以製作蕨餅、林屋抹茶芭菲及特濃焙茶雪山等，亦有手打抹茶飲品。,太古太古城道22號明宮閣地下G406號舖
首爾家韓國料理,Seoul House,4,$101-200,韓國菜/烤肉/韓式炸雞/韓燒,提供傳統韓式料理，推介足料的人蔘雞湯。雞內釀有糯米，令口感更豐富。燒肉如牛肋骨、五花肉腩及大蝦也值得一試。,銅鑼灣邊寧頓街13-15號隆堡柏寧頓酒店1樓
貓之眼,Cats' eye,4,$51-100,日本菜/咖喱/日式西餐/咪嘥嘢食店,日式蛋包飯專門店，招牌作是巨型漢堡扒放在眼型蛋包飯上，形同貓貓眼睛一樣，可愛得來食物亦有水準。,灣仔汕頭街25號地舖
三川居酒屋,Sansen Japanese Bar and Restaurant,4,$101-200,日本菜/壽司/刺身/居酒屋,位於銅鑼灣的新開日式居酒屋，店內裝潢以木系為主調，充滿日式感覺，另有VIP房，適合朋友聚會。居酒屋除了一系列燒物、刺身、丼飯，還有不同種類的清酒提供，宵夜時段則有燒物清酒拼盤提供。,銅鑼灣軒尼詩道499號永光商業大廈地庫
Bilibala Yakitori Bar,,4,$201-400,日本菜/串燒/酒吧,希望為你奉上最好的串燒，及提供舒適的環境以供三五知己閒談相聚，一起‘Bilibala’,銅鑼灣希雲街23號禮雲大樓地下
熊本燒肉,Yakiniku Kumamoto,4,$201-400,日本菜/烤肉/日式放題,提供日式燒肉放題的餐廳，特別供應其他放題少見的蟹膏甲羅燒。大部分食物都未經醃製，可自行以多款調味料調味。,銅鑼灣謝斐道477-481號3樓
熊拉麵,Kuma Ramen,4,$51-100,日本菜/拉麵,,上環蘇杭街84號
Mad for Garlic,,4,$101-200,韓國菜/意大利菜/薄餅,,大角咀海庭道18號奧海城二期1樓105A號舖
Nardo's Cafe,,4,$51-100,西式/樓上cafe,踏進店內，被紅白兩色的設計吸引，顏色形成強烈的對比，充滿活力，予人優閒舒適之感，配合樓上Cafe的主題。全店傢具及招牌均是設計師全人手製作，別具用心且是獨一無二之作。,旺角彌敦道594-596號旺角新城8樓全層
Studio Caffeine,,4,$51-100,西式/All Day Breakfast/沙律/咖啡店,Studio Caffeine是一間售賣精品咖啡為主的咖啡廳。我們認為咖啡不單只是一杯含有咖啡因的飲品，咖啡更是關於品嚐與欣賞的藝術，我們的團隊希望可以將精品咖啡的文化推廣至大眾。,佐敦廟街284號地下
Bella Shine,,4,$101-200,日本菜/西式/拉麵/串燒/日式西餐,觀塘工業大廈內的日式和風系西餐廳，運氣好的話可遇上紫薯餐湯。,觀塘巧明街114號迅達工業大廈2樓B室
Give Me 5,,4,$101-200,西式/海鮮/自助餐/酒吧,,觀塘鴻圖道90號5樓
Cafe Paradise,,4,$51-100,意大利菜/西式/甜品/糖水/All Day Breakfast/咖啡店/少鹽少糖食店,店內設有巨型旋轉木馬擺設、南瓜車及不少公仔，影相打卡一流。供應All Day Breakfast、意粉、小食等，飲品亦有咖啡、甜品等，賣相吸引。,太子砵蘭街412號地舖
咖啡弄,Coffee Alley,3.5,$101-200,西式/咖啡店,台灣人氣輕食店，將大量台灣總店元素搬來香港，同時引入台灣特產食材，口味道地。,尖沙咀漢口道38號漢興大廈1樓
Playa de Papagayo,,4,$101-200,西班牙菜/酒吧,,尖沙咀河內道5號普基商業中心地下N3號舖
部屋咖啡室,homemadecafe,4,$101-200,西式/樓上cafe,,旺角登打士街43H號登打士廣場12樓
Moreish & Malt,,4,$101-200,美國菜/漢堡包/扒房/酒吧,空間感不俗的美國菜餐廳，招牌菜包括美國肉眼扒、Nachos、蟹肉藏紅花忌廉汁意大利飯。,觀塘鴻圖道48號地下B號舖
雅苑座,The Greenery,4,$401-800,西式/多國菜/自助餐/酒店餐廳,雅苑座咖啡室以暖色為主色，位於全港獨有的110呎高室內空中花園及噴泉內，彷彿置身於大宅後花園，晚餐亦邀请琴師現場演奏。自助午餐和自助晚餐提供新鲜海鲜和各地美食，菜式隨季節不斷變化，佳餚琳琅滿目。,尖沙咀麼地道69號帝苑酒店3樓
Olive ERA,,4,$101-200,西式,以創意歐陸菜式為主，由經驗豐富廚師烹調，加入創新元素概念，設計出多款菜式，價錢合理。由午餐晚下午茶餐至特長Happy Hour，更提供多款餐酒。格調設計優閑舒適，提供一個三五知己相聚享受美食的好地方。,黃大仙睦鄰街8號現崇山商場地下G1-G2號舗
Burgerman,,4,$51-100,美國菜/漢堡包/快餐店,香港最佳漢堡包店之一，漢堡款式特別，包括鵝肝漢堡及和牛漢堡等，均大受歡迎。,大角咀埃華街95-97號地下
WOFT,,4,$101-200,西式,主打手工啤酒，提供來自德、澳、美、日、新西蘭及本地等等，約60款手工啤，價錢賣五十多元至七十多元。酒吧食物由澳門葡京米芝蓮餐廳的大廚設計，用料破格，如腐乳芝士火鍋、梅菜和牛漢堡、白汁蘑菇煙肉狗仔粉及避風塘薯條等。,旺角染布房街7-8D地下
