name,sub_name,score,price,labels,introduction,address
倫哥尚品火鍋私房菜,Lung Gor Private Club,4,$201-400,粵菜 (廣東)/港式/火鍋/海鮮/私房菜/名人店,藝人杜大偉開設的火鍋店。雞煲、火鍋一應俱全。海鮮拼盤、刺身拼盤等食材新鮮而且份量十足。,觀塘創業街13號萬泰利廣場地舖
阿鴻小吃,Hung's Delicacies,3.5,$101-200,潮州菜/港式/中菜館/少鹽少糖食店,除了秘製滷味外，店內還有不少香港少見潮州菜，鴨舌及撈麵為招牌菜。,觀塘鴻圖道83號東瀛遊廣場地下A舖
龍閣極上火鍋料理,Dragon Court Premium Hot Pot Cuisine,4,$201-400,粵菜 (廣東)/火鍋/中菜館,,紅磡黃埔天地享膳坊(第4期)地下G4號舖
饕牛記,,3.5,$201-400,潮州菜/火鍋,,旺角西洋菜南街138號福苑2樓
彩福婚宴,Choi Fook Eky's Banquet,4,$101-200,粵菜 (廣東)/海鮮/點心/酒樓,,佐敦彌敦道348號彌敦坊2樓東翼
粵來順,Yuet Lai Shun,3.5,$101-200,粵菜 (廣東)/燒臘/中菜館,懷舊主題裝修廣東菜館，由名廚主理烹調香港地道風味粵菜。,旺角登打士街2-8號寶亨大廈地舖10-12號
嘉麟樓,Spring Moon,3.5,$401-800,粵菜 (廣東)/海鮮/點心/中菜館/酒樓/酒店餐廳/少鹽少糖食店,嘉麟樓的裝潢仿照半島酒店於1928年開業時期的中菜館。餐廳裡的木屏風、彩色玻璃及古董藝術擺設等，流露出1920年代建築師Frank Lloyd Wright的風格。嘉麟樓每天供應點心、多款粵式佳餚，並由專人介紹及沖泡超過25種上等茶品，配合賓客的口味，增添飲食閒趣。嘉麟樓的「廚師之桌」，可供六位賓客享用，最少四位起。,尖沙咀梳士巴利道22號香港半島酒店1樓
譽小館,Praise Dining Bristro,4,$51-100,粵菜 (廣東)/港式/燒臘/中菜館/酒樓,,大角咀海庭道18號奧海城二期1樓103號
阿爺粥膳八鮮鍋,Grandpa's Porridge Shabu Shabu,4.5,$201-400,粵菜 (廣東)/港式/火鍋/粥品/名人店,藝人楊證樺開設的養生粥品火鍋店，以家傳煮粥食譜及高級食材烹煮各款粥底，每天最少煲5小時﹐口感綿滑。,旺角登打士街43H號登打士廣場3樓
鳳城酒家,Fung Shing Restaurant,3.5,$101-200,粵菜 (廣東)/順德菜/點心/酒樓,始創於1954年的中菜酒樓，主廚兼老闆將道地順德菜帶來香港，大良炒鮮奶及燒乳豬風味傳統。,太子彌敦道749號歐亞銀行大廈1-2樓
甜記餃子,Tin Kee Dumpling Restaurant,4,$51-100,粵菜 (廣東)/港式/粉麵/米線/雲吞/餃子/小食店,,長沙灣昌華街23號富華廣場19號地舖
龍門樓 - 志蓮素齋,Chi Lin Vegetarian,4,$101-200,粵菜 (廣東)/素食,志蓮素齋提供山家素菜，選用新鮮食材，以低油、低鹽、低糖、無味精、低膽固醇的健康烹調法炮製，一切淨收入全數撥作南蓮園池管理及營運經費。,鑽石山鳳德道60號南蓮園池龍門樓
囍雲天酒家,Cheerful Sky Cuisine,4,$101-200,粵菜 (廣東)/港式/燒臘/點心/中菜館/酒樓/咪嘥嘢食店,,觀塘觀塘偉業街223至231號宏利金融中心1樓1號
滿粥順德粥底海鮮火鍋,,4,$201-400,順德菜/火鍋/粥品,,新蒲崗景福街79號地舖
NeNe Chicken,,3.5,$101-200,韓國菜/韓式炸雞,由國民MC劉在石代言的韓國人氣炸雞品牌過江到港，炸雞分原味、芝士、甜辣等不同口味，推介灑上芝士粉的初雪炸雞，芝士及醬汁均由韓國直送到港。,旺角亞皆老街8號朗豪坊11樓30號舖
越滿,The Pho,4,$51-100,越南菜/咪嘥嘢食店,,旺角洗衣街111號建煌華廈地舖
大漁屋台,,4,$101-200,日本菜/爐端燒/壽司/刺身/居酒屋,,牛頭角牛頭角道3號得寶商場地下123號舖
上岸料理,Kamigishi Restaurant,4.5,$401-800,日本菜/壽司/刺身,,尖沙咀棉登徑7-9號地下B舖
爆丼屋,Big Bang Don,3.5,$101-200,日本菜/壽司/刺身/咪嘥嘢食店,人氣日式海鮮丼店，不時有人龍排隊。魚生堆得滿瀉如小山丘，份量驚人，推介北海道盛丼、火焰盛丼、爆盛慢燒牛肉丼。,旺角豉油街50號地下8號舖
神輿日本料理,Mikoshi Japanese Restaurant,4,$101-200,日本菜/壽司/刺身/日式放題,,旺角彌敦道593-601號創興廣場5樓
Gram cafe & pancakes,,3.5,$101-200,日本菜/甜品/糖水/西式糕點,,尖沙咀彌敦道100號The ONE 4樓L408舖
宗像屋,Munakataya,4,$101-200,日本菜/壽司/刺身,專賣海鮮丼的日式餐廳，每款海鮮丼內有９種或以上的魚貝海鮮，有趣的是客人可同時品嚐３種食法，包括傳統魚生飯、自製手卷及茶漬飯。,深水埗青山道60號地下B舖
鮨文,Sushi Man,4.5,$801以上,日本菜/壽司/刺身,,紅磡黃埔天地聚寶坊(第11期)地下G22A號舖
第一郡,Q1,4,$50以下,越南菜/粉麵/米線/漢堡包/小食店,,深水埗荔枝角道315號地舖
炑八韓烤,MeokBang Korean BBQ & BAR,4,$201-400,韓國菜/烤肉/韓燒,,旺角彌敦道628號瓊華中心5樓
鮨心,Kokoro Sushi,4,$201-400,日本菜/壽司/刺身/廚師發辦,,旺角彌敦道703-705號金鑽璽1樓(快富街入口)
Moshi Moshi,,4,$201-400,日本菜/壽司/刺身,,尖沙咀金巴利道35號金巴利中心地下B舖
一杯鐵板燒居酒屋,"E-pai, teppan-yakitori",4,$101-200,日本菜/壽司/刺身/串燒/居酒屋,裝潢充滿日本風的居酒屋，提供大阪系料理如大阪燒及鐵板燒等，適合大夥朋友下班後小酌，甚有氣氛。,觀塘觀塘道418號創紀之城五期(apm)4樓20-21號舖
BYOB Coffee Roaster,,4,$51-100,西式/咖啡店,,屯門青桃徑5號文翔大廈地下2A號舖
euro go go,,3.5,$51-100,西式/粉麵/米線/薄餅,"歐陸半自助及開放式設計，一直為顧客提供輕鬆味美的用餐環境。 

多款即叫即焗薄脆Pizza、彈牙意粉、冶味小吃，配合即磨意大利Barbera咖啡及芝士蛋糕。快餐以外的另一優質選擇。而且每月也有會員優惠。",葵芳興芳路223號新都會廣場1樓168-169號舖
留白,Blank Cafe,4,$51-100,西式/甜品/糖水/All Day Breakfast/咖啡店,,荃灣西樓角路202-216號荃昌中心昌寧商場地下12號舖
Glasshouse,,3.5,$101-200,泰國菜/西式,,元朗元龍街9號形點一期1樓1028-1029號舖
海圖,Café Heato,3.5,$50以下,意大利菜/All Day Breakfast/咖啡店,"提供精品咖啡,單品咖啡,店中所有自家製作",屯門虹橋青柏徑6號鹿苑16號舖
Chef's Movement,,4,$51-100,西式,,元朗鳳攸北街11號益發大廈地下15號舖
屏山跑車餐廳,Motors Café,4,$101-200,西式/咖啡店,以賽車為主題的餐廳，門面及店內裝飾都有跑車，連餐枱椅都是車子座位，必吃黑松露糖心蛋雜菌意粉、賽車手簿餅及雞翼三重奏。,元朗屏山坑尾村105號地舖
URBAN Cafe Commune,,3.5,$101-200,西式/漢堡包/All Day Breakfast,,元朗元龍街9號形點一期1樓1030A號舖
Gastrobox by Okapi Cafe,,3.5,$101-200,意大利菜/西式,,西貢萬年街67號
蠔站,OS Plus,3.5,$201-400,西式/海鮮/蠔吧,全港有多間分店，生蠔來自各國地區新鮮空運來港，包括法國、澳洲、愛爾蘭、南非及美國等，亦有不同海鮮及刺身，價錢公道。餐廳另有各款牛扒、意粉及薄餅等菜式選擇。,荃灣楊屋道1號荃新天地一期上層地下UG41號舖
Café Circles,,4,$201-400,西式/自助餐/酒店餐廳/咪嘥嘢食店/少鹽少糖食店,,荃灣楊屋道8號香港如心海景酒店暨會議中心9樓
柏斯意大利餐廳,Pezzi Bistro,4,$201-400,意大利菜/酒/薄餅/All Day Breakfast/西餐廳/蠔吧,,粉嶺聯和墟聯和道1號地舖
意粉屋,The Spaghetti House,3.5,$101-200,意大利菜/薄餅/無肉餐單/西餐廳,"""自1979年起，意粉屋以款式繁多味美的意粉成功建立了「意粉專家」的地位。憑藉大廚的精湛廚藝、挑選最上等的材料，如來自意大利的意粉、新鮮蔬菜、優質橄欖油及芝士等等，多年來為客人帶來無限美味驚喜。\r\n意粉屋在香港及南中國擁有超過25間分店，店舖設計時尚舒適，裝修更會定期作出提升，而所有員工均致力為客人提供無微不至的服務。\r\n我們的使命，是慇懃款待每一位顧客，端上營養豐富的美食，讓您在最舒適的環境裡細意品嚐。顧客的欣悅和滿足，就是我們的動力。""\r\n",沙田沙田正街18號新城市廣場一期153-154號舖
班戟館,Crepe N Cream,4,$51-100,法國菜/甜品/糖水/All Day Breakfast/沙律,,屯門井財街9號地下20B號舖
Outback Steakhouse,,3.5,$201-400,澳洲菜/扒房,,荃灣青山公路荃灣段398號愉景新城3樓3004號舖
興城潮州粥,,,$50以下,潮州菜/粥品,,長洲興隆正街95 號
新樂海鮮酒家,Sun Lok Seafood Restaurant,,$51-100,粵菜 (廣東)/海鮮/點心/海鮮酒家,,大嶼山梅窩涌口街28號A
怡軒海鮮美食,Yee Henn Sea View Restaurant,3,$101-200,粵菜 (廣東)/海鮮/熟食中心,,大嶼山梅窩碼頭熟食中心C1-3號舖
海景茶座,Seaview Cafe,,$51-100,粵菜 (廣東)/港式/西式/茶餐廳/冰室,,東涌海濱路東涌新發展碼頭K2&K3舖
得得好店茶餐廳,,3,$50以下,潮州菜/粉麵/米線/茶餐廳/冰室,,長洲海傍街91C地下
濤濤居火鍋煲仔菜,,,$51-100,粵菜 (廣東)/川菜 (四川)/火鍋/海鮮/中菜館,,長洲北社七里一號前座
凱星軒,Winsea Seafood Restaurant,,$101-200,粵菜 (廣東)/中菜館,,南丫島索罟灣第一街1A-1B
立農茗茶,,,$51-100,粵菜 (廣東)/茶館,,大嶼山昂坪市集8號舖
南丫海景民豐海鮮酒家,Lamma Seaview Man Fung Seafood Restaurant,3,$401-800,粵菜 (廣東)/海鮮/中菜館/咪嘥嘢食店,招牌菜為梅子膏蟹，用秘製梅子醬汁，惹味非常。,南丫島榕樹灣大街5號地下
壽記海鮮酒家,Sau Kee Seafood Restaurant,3,$51-100,粵菜 (廣東)/海鮮/點心/中菜館/海鮮酒家/咪嘥嘢食店,,南丫島榕樹灣大街43號地下
潮發餐廳菜館,,2,$51-100,粵菜 (廣東)/中菜館/茶餐廳/冰室,,長洲北社海傍路13C地下
威尼斯酒家,,2.5,$51-100,粵菜 (廣東)/點心/酒樓,,大澳永安街16號地下
海龍王海鮮大排檔,Sea Dragon King,2,$101-200,粵菜 (廣東)/海鮮/中菜館,,長洲熟食市場向海16號檔位
聯安燒腊飯店,Luen On Restaurant,,$50以下,粵菜 (廣東)/燒臘,,坪洲坪洲永安街12號地下
合成飯店,Hop Shing Restaurant,,$51-100,粵菜 (廣東)/中菜館,,大嶼山貝澳羅屋村4號
二悅,Moon Moon,4,$51-100,台灣菜/粉麵/米線,,元朗合益路9-15號紀業樓地下G號舖
貴川風味館,Kwai Tsuen,4,$50以下,滇菜 (雲南)/粉麵/米線,,元朗教育路44-50號兆明樓地下B號舖
尚點 小籠包.上海麵館,Shouten Shanghai Noodle House,3.5,$51-100,滬菜 (上海)/粉麵/米線/點心/雲吞/餃子/中菜館,以優質上海菜式為賣點，主要提供點心及麵食，既保持傳統上海風味，同時加入創新賣相及組合；以精湛、巧妙的手藝自創多款特色上海菜。,沙田銀城街1-2號置富第一城1樓117A號舖
湯•米,Soup And Rice,4,$51-100,台灣菜/火鍋,,將軍澳唐賢街23號帝景灣商場1樓40號舖
愛 . 添,Appétit,3.5,$50以下,台灣菜/西式/甜品/糖水/小食店,,屯門井財街15號金銘大廈地下3號舖
夏茶,HA CHA,3.5,$50以下,台灣菜/台式飲品,,元朗康樂路8號康樂廣場地下3號舖
上海婆婆336,Shanghai Po Po 336,3.5,$101-200,滬菜 (上海)/中菜館,,將軍澳坑口重華路8號東港城場第1層181號舖
山城小麵,Shan Cheng Noodles,4.5,$50以下,川菜 (四川)/粉麵/米線/雲吞/餃子,,大埔懷仁街3號地舖
翡翠拉麵小籠包,Crystal Jade La Mian Xiao Long Bao,3.5,$101-200,滬菜 (上海)/拉麵/中菜館/少鹽少糖食店,,荃灣大壩街4-30號荃灣廣場3樓337號舖
上海婆婆,Shanghai Po Po,3.5,$101-200,滬菜 (上海)/中式包點/中菜館,,屯門屯門鄉事會路83號V City商場1樓10號舖
Cup Of...,,4,$50以下,台灣菜/台式飲品/果汁,提供多款飲料的外賣飲品店，當中綜合水果茶以時令新鮮生果製作，賣相非常吸引。,荃灣昌泰街5號富榮大廈地下1號舖
海港燒鵝海鮮酒家,Victoria Harbour Roasted Goose Seafood Restaurant,3.5,$101-200,粵菜 (廣東)/海鮮/點心/海鮮酒家/咪嘥嘢食店,,馬鞍山鞍駿街1號馬鞍山中心1樓
三小姐海鮮小菜,,3.5,$101-200,粵菜 (廣東)/海鮮/熟食中心/名人店,由前歌手黃翊於大埔墟街市樓上開設的餐廳，主力提供多款中式小菜，必試椰皇燉奶及秘製黃金蝦。,大埔鄉事會街8號大埔墟街市及熟食中心2樓CFS35號舖
翠園,Jade Garden,3.5,$101-200,粵菜 (廣東)/點心/酒樓,,將軍澳唐賢街9號PopCorn商場2樓1-2號舖
傲嚐,Pride Team Limited,3.5,$201-400,粵菜 (廣東)/海鮮/私房菜,,荃灣柴灣角街83號榮興工業中心4樓409室
興記,Hing Kee,3,$201-400,粵菜 (廣東)/海鮮/大牌檔,,屯門三聖村熟食亭地下2號舖
鳳鳴居,FENG MING HOUSE,4,$51-100,粵菜 (廣東)/港式/車仔麵/粉麵/米線,,上水馬會道154號地下
三和火鍋雞煲,,3.5,$101-200,粵菜 (廣東)/港式/火鍋/雞煲/大牌檔,,上水石湖墟新街市二樓CF23號舖
明星皇宮,Star Palace,3.5,$101-200,粵菜 (廣東)/點心/酒樓,,元朗阜財街34-36號光華中心2-3樓
翠園,Jade Garden,3,$101-200,粵菜 (廣東)/點心/酒樓,,元朗元龍街9號形點一期2樓2039號舖
潮州仔食堂,,4,$50以下,潮州菜/港式/粉麵/米線,,荃灣沙咀道355號地下
玉庭,Jade Pavilion,4,$201-400,潮州菜/粵菜 (廣東)/酒店餐廳,,沙田白鶴汀街8號帝都酒店1-2樓
釣魚翁 燒鵝．海鮮飯店,Diaoyuweng Roasted Goose And Seafood Restaurant,3.5,$201-400,粵菜 (廣東)/火鍋/點心/酒樓,,荃灣眾安街68號荃灣千色匯I期5樓5B號舖
海港酒家,Victoria Harbour Restaurant,3.5,$101-200,粵菜 (廣東)/火鍋/點心/酒樓/咪嘥嘢食店,,天水圍天華路30號T Town South2樓S224號舖
和味塘,Wo Mei tong,4,$51-100,粵菜 (廣東)/港式/中菜館,,大埔大埔墟大明里5號地舖
蓮香棧,,3,$101-200,粵菜 (廣東)/粥品/點心/中式包點/酒樓,,荃灣蕙荃路22-66號綠楊坊L1樓P9-9A號舖
象泰宴,Jaunty Restaurant,4.5,$51-100,泰國菜,,屯門青善街康景花園8-10號舖
炑八韓烤,MeokBang Korean BBQ & BAR,4,$201-400,韓國菜/烤肉/韓燒,,荃灣眾安街2-8號周合成大廈1樓
寿司源,Sushi Hajime,4.5,$801以上,日本菜/壽司/刺身/廚師發辦,,元朗青山公路1號珍珠樓地下10號舖
炑八韓烤,MeokBang Korean BBQ & BAR,3.5,$201-400,韓國菜/烤肉/韓燒,,沙田沙田正街11-17號偉華中心2樓8號C舖
御和亭日本料理,,4,$101-200,日本菜/壽司/刺身,,大埔翠和里1號永發樓B座地下
囍越,What The Pho,3.5,$101-200,越南菜,,屯門屯隆街3號屯門市廣場一期3樓3271號舖
花見月,Yayoi Japanese Dining Room,4,$101-200,日本菜/壽司/刺身/日式西餐/咪嘥嘢食店,,沙田白石角香港科學園第二期科技大道西8號尚湖樓地下S036號舖
赤橋拉麵,Akabashi Ramen,3.5,$51-100,日本菜/拉麵/粉麵/米線,,屯門青菱徑9號華利大廈地下5號舖
一休(居食屋)日本料理,,4,$101-200,日本菜/壽司/刺身,,青衣擔桿山路6號長發廣場地下114號B舖
德美壽司,Sushi Tokumi,4,$101-200,日本菜/壽司/刺身,,大埔翠和里1號永發樓地下1A舖
浜燒太郎,Majimeya,4,$101-200,日本菜/海鮮/爐端燒/居酒屋,,將軍澳唐俊街21號翩滙坊地下G23舖
忠誠茶座泰國菜,Chung Shing Thai Restaurant,3.5,$51-100,泰國菜/咪嘥嘢食店,,大埔汀角路大尾篤村69B-72號地下
稚,Childhood lzakaya,4,$51-100,日本菜/串燒/居酒屋,,元朗俊賢坊18號權益大樓3號舖
三品 燒鳥專門店,,4,$201-400,日本菜/串燒/居酒屋,主打串燒的居酒屋，特別提供廚師發辦串燒，食客可於吧枱欣賞廚師烹調及交流飲食心得。,元朗教育路61號紫荊樓一期地下K號舖
Kim's Spoon,,3.5,$101-200,韓國菜,,荃灣青山公路荃灣段264-298號南豐中心2樓32C號舖
Caviar House & Prunier,,,$201-400,法國菜/海鮮,,赤鱲角香港國際機場一號客運大樓(禁區)7E143號舖
星巴克咖啡,Starbucks Coffee,,$50以下,美國菜/沙律/西式糕點 /咖啡店,,赤鱲角香港國際機場一號客運大樓7樓離港大堂M701號舖(非禁區)
華岸酒吧扒房,The China Coast Bar + Grill,3.5,$101-200,美國菜/無肉餐單/扒房/酒吧/酒店餐廳,設計時尚同時貫徹餐廳的典雅格調，在柔和燈光及現場音樂伴奏下更添浪漫。提供上乘牛排及海鮮佳餚，配世界各地知名釀酒區的上等葡萄酒，是商務午餐及消閒用膳的選擇。,赤鱲角暢達路9號富豪機場酒店地下
釗記冰室,Chiu Kee,,$50以下,港式/西式/茶餐廳/冰室,,長洲大新海傍路113號地下
Moccato,,3.5,$101-200,西式/麵包店/甜品/糖水/酒店餐廳,Moccato的咖啡由瑞士烘培及進口的Arabica咖啡豆沖調而成，每天更供應新鮮烘製的飽點。招牌飲品包括與餐廳同名的Moccato、Caramel Orange Latte及Black and White Mocha。為滿足一眾喜愛朱古力的人仕，Moccato以頂級可可豆，炮製一系列的朱古力特飲及甜品作主打。,東涌文東路51號諾富特東薈城酒店2樓225號舖
肯德基家鄉雞 (KFC),Kentucky Fried Chicken,2.5,$50以下,美國菜/快餐店,,東涌逸東街8號逸東商場一期地下17號舖
Banyan Bay Cafe,,3.5,$51-100,西式,,南丫島榕樹灣大街67A號地下
好萊塢快餐店,Hollywood & Dine,3.5,$51-100,美國菜/快餐店,,大嶼山香港迪士尼樂園迪士尼好萊塢酒店
大澳榕樹頭,Tai O Banyan Tree,4.5,$51-100,西式/麵包店/甜品/糖水/茶館,,大澳吉慶街 68 號地下
The Bounty Entertainment & Sports Bar,,,$101-200,西式/酒/酒吧/酒店餐廳,,愉景灣愉景灣海澄湖畔路88號香港愉景灣酒店地下
Panopolis,,3,$50以下,西式/麵包店/無肉餐單,,赤鱲角香港國際機場一號客運大樓第7層離港層東大堂 (禁區)
海岸餐廳,Island Cafe,3,$50以下,港式/西式/燒臘/快餐店,,愉景灣D'Deck1樓104A號舖
創意美食美食車,Creative Yummy Food Truck,,$51-100,美國菜/三文治/美食車,,大嶼山香港迪士尼樂園、梳士巴利花園（各區流動）
Andante,,3,$101-200,西式/薄餅/自助餐/酒吧/酒店餐廳,Andante於節奏中是行板(walking pace)的意思，如散步般悠然自在。Andante是世界有名的室內設計師Yasumichi Morita的作品，由小木珠組成的三層吊飾，設計獨特，輕易成為全場焦點，同時營造出輕鬆柔和的氣氛。酒吧的高度比一般的矮，讓客人坐下時與酒吧內站立的服務員處於同一高度，方便交談。小型鋼琴設於高台之上，無論坐在那一個角落，均能欣賞到鋼琴手的精彩爵士樂表演。,東涌文東路51號諾富特東薈城酒店大堂
星巴克咖啡,Starbucks Coffee,3.5,$50以下,美國菜/沙律/西式糕點 /咖啡店,,赤鱲角香港國際機場二號客運大樓翔天廊5樓5P009號舖(非禁區)
Pak Shing Kitchen,,,$50以下,泰國菜,,東涌達東路20號東薈城B1樓01號舖TASTE超市
Soi 1 泰集,,,$50以下,泰國菜/甜品/糖水/小食店,,東涌富東街6號富東廣場地下富東街市M01號舖
華御結,Hana-Musubi,,$50以下,日本菜/壽司/刺身,,赤鱲角順暉路33號港珠澳大橋香港口岸旅檢大樓地下307號舖
Hungry Korean,,,$51-100,韓國菜/快餐店,,赤鱲角暢達路1號香港國際機場機場客運大樓 (禁區)6樓離港層西大堂食東西
匠工房秀吉,Hideyoshi,,$50以下,日本菜/薄餅/鐵板燒,,東涌達東路20號東薈城名店倉地庫Taste超級市場
中與志,,,$51-100,日本菜/壽司/刺身,,愉景灣海湖畔路92號愉景北商場地下G11號舖惠康超級市場內
南昌美食,Chok Dee Thai Food,,$101-200,泰國菜/烤肉/咖喱/串燒,,坪洲永安街40號地舖
Spicy Island Restaurant & Bar,,,$51-100,印度菜,,南丫島榕樹灣大街7A-B號舖
MUJI to GO,,,$50以下,日本菜,,赤鱲角暢達路1號香港國際機場機場客運大樓 (禁區)7樓7T086號舖
Bombay bar,,,$51-100,印度菜/咖喱,,南丫島榕樹灣後街地下6號舖
小弟,MiniBros,,$50以下,日本菜/小食店,,長洲新興海旁街17號地下
海之日日本料理,Hoi Chi Yat Japanese Restaurant,3.5,$51-100,日本菜/壽司/刺身,,長洲建新里13號地下
長沙小廚,High Tide,4,$51-100,泰國菜/咖喱/露天茶座,"提供各式各樣大小宴會,婚宴,燒烤派對,自助餐等",大嶼山長沙下村35號地下
味千拉麵,Ajisen Ramen,3,$51-100,日本菜/拉麵,味千拉麵店始創於1968年，發源地日本九州的熊本。,赤鱲角香港國際機場一號客運大樓7樓離港層東大堂 (禁區)
Chateraise,,,$50以下,日本菜/西式糕點 /咖啡店,,東涌達東路20號東薈城名店倉B1樓B12號舖
Porterhouse,,4,$201-400,西式/扒房,Porterhouse揭開了色、香、味的新角度，將煥然一新的活力注入了富有格調的空間和季節性的菜單中。由行政總廚Angelo Vecchio主理，Porterhouse並不僅僅用招牌燒烤肉扒取悅大眾，他們還提供品種繁多的海鮮，生吃或煎烤隨意選擇,中環蘭桂坊德己立街30-32號加州大廈7樓
白鬍子炸魚薯條,White Beard Fish n Chips,4,$51-100,英國菜/西式/漢堡包/快餐店,,中環蘇豪卑利街55號地下A號舖
Elephant Grounds,,3.5,$50以下,西式/甜品/糖水/咖啡店,,銅鑼灣Fashion Walk百德新街42-48號地下C舖
快船廊,Clipper Lounge,4,$401-800,西式/自助餐/酒店餐廳,歷史悠久的快船廊更是香港本地人與酒店客人最喜愛，早餐及晚餐自助餐大受歡迎，星期日的香檳早午餐也深受香港人喜愛，而快船廊最有名的就是下午茶。,中環干諾道中5號香港文華東方酒店閣樓
Springfields,,4,$51-100,法國菜/西式/甜品/糖水/西式糕點 /咖啡店,,中環擺花街11號地鋪
La Famille,,4.5,$50以下,法國菜/甜品/糖水/西式糕點,,銅鑼灣耀華街25號丹納中心地下2號舖
"The Italian Club - Wine Bar, Steak House & Pizza Gourmet",,4,$201-400,意大利菜/酒/薄餅/扒房/酒吧,,中環蘇豪伊利近街1-5號地舖
BAKE Cheese Tart,,3.5,$50以下,日本菜/西式/麵包店/甜品/糖水/小食店,BAKE起源於北海道洋菓子老店KINOTOYA，招牌起司塔的軟心起司餡料由北海道函館生產的輕味起司、來自別海的濃味起司，以及法國鹽味奶油起司搭配而成。牛油曲奇餅塔皮用上「二重燒製法」，口感更鬆脆。,銅鑼灣軒尼詩道555號崇光百貨B2樓10號舖
J.Co Donuts & Coffee,,4,$51-100,西式/雪糕/乳酪/三文治/西式糕點 /咖啡店,來自印尼的冬甩專門店，較受歡迎的口味有比利時白朱古力和杏仁片、牛油果及抹茶味等。,灣仔軒尼詩道55號地下1及2號舖
CAFÉ LANDMARK,,4,$401-800,西式,2001年7月31日首次開業，08年4月關閉重修後，於7月重新開業，主打多元化、簡單及賣相精緻的歐陸菜，新增簡約酒吧區及Gourmet Cake Shop。,中環皇后大道中15號置地廣場中庭1樓107-108號舖
Kampoeng,,4,$51-100,印尼菜/西式/湯品/薄餅/咖喱/沙律/茶餐廳/冰室,,銅鑼灣糖街1-5號銅鑼灣商業大廈地庫
茶園,Tiffin,4,$401-800,西式/自助餐/酒店餐廳/咪嘥嘢食店,欣賞現場爵士樂四重奏和鋼琴表演,灣仔港灣道1號君悅酒店閣樓
Le Rêve,,4,$401-800,日本菜/法國菜/Fine Dining,,銅鑼灣耀華街38號Zing! 10樓
Beef & Liberty,,4,$101-200,英國菜/西式/漢堡包,,中環蘭桂坊德己立街32號加州大廈3樓
No Milkshake No Life,,4,$51-100,西式/三文治/快餐店/小食店,主打奶昔及各式三文治的小店，餐廳裝飾懷舊。,西環石塘咀山道31-37號地下A舖
點·子·巷,Bistro Lane,4,$51-100,台灣菜/京川滬/台式飲品,隱身在小巷當中的台灣料理小店，主打一系列台式麵飯及小食，例如相當受歡迎的呀婆蔥油雞絲撈蕎麥麵，和蝦醬腩肉虎夾包。,鰂魚涌海堤街6-16號龍景大廈地下8號舖
麵館皇,Noodleholic,3.5,$51-100,滬菜 (上海)/粉麵/米線,,銅鑼灣登龍街32號地下
RBTea,,3.5,$51-100,台灣菜/西式/甜品/糖水/三文治/咖啡店/日式西餐,,銅鑼灣記利佐治街1號金百利廣場3樓323-327號舖
青藏牛肉麵,Beef Noodles,3.5,$51-100,新疆菜/陝菜 (陝西)/粉麵/米線/串燒/串燒店,,北角錦屏街41A號地舖
上海弄堂菜肉餛飩,Shanghai Lane,4,$51-100,滬菜 (上海)/無肉餐單/中菜館/咪嘥嘢食店,上海弄堂菜肉餛飩所供應的菜肉餛飩、烤麩、古法紅燒肉及燻魚都是傳統上海風味。,跑馬地綿發街10號地舖
巴依餐廳,Ba Yi Restaurant,3.5,$101-200,新疆菜/雲吞/餃子/中菜館,香港少有的正宗新疆菜，老闆為新疆人，所用的香料也來自新疆，主打北方主食羊肉及麵食。,西環水街43號地下
醋娘子,Mrs. Vinegar,3.5,$51-100,滬菜 (上海)/粉麵/米線/雲吞/餃子/中菜館,,上環永樂街139號地下B舖
陳勤記鹵鵝飯店,Chan Kan Kee Chiu Chow Restaurant,3.5,$101-200,潮州菜/中菜館,除了招牌滷水鵝外，也提供其他潮州食品，包括蠔餅、蠔仔肉碎粥等。,上環皇后大道西11號地舖
皇苑,Royal Garden,4,$101-200,粵菜 (廣東)/點心/中菜館/海鮮酒家,,筲箕灣筲箕灣東大街109-113號1樓及113號地舖
望月軒,Moon Palace,4,$101-200,粵菜 (廣東)/川菜 (四川)/火鍋/海鮮/山珍海味/點心/中菜館,,上環干諾道中168-200號信德中心西座3樓澳門廣場3017號舖
西塘花記,,4,$51-100,粵菜 (廣東)/雲吞/餃子,,灣仔天樂里3-5A號僑康大廈地下C號舖
鈺膳潮州私房菜,Yuk Cuisine,4.5,$101-200,潮州菜/中菜館/私房菜,,灣仔駱克道117號地下4號舖
