name,sub_name,score,price,labels,introduction,address
漁民麵館,Fisherman,3.5,$51-100,粵菜 (廣東)/粉麵/米線/山珍海味/中式糖水,以高質食材配搭平民撈麵，招牌菜為花膠蠔汁撈麵。嚴選來自冰島的鱈魚花膠，口感軟腍，膠質感重。,元朗擊壤路9號金寶大廈4號地舖
裕記大飯店,Yue Kee Restaurant,3,$101-200,粵菜 (廣東)/燒臘/中菜館,超過50年歷史的燒鵝老店，選用廣州自設鵝廠的黑鬃鵝，以炭火烤製，皮香且脆。,深井深康路9號地舖
點饌,Dum Sum Deluxe,4,$51-100,粵菜 (廣東)/港式/點心,,沙田石門安群街3號京瑞廣場1期2樓237號舖
大鍋口海鮮火鍋店,Giant Seafood Hot Pot,3.5,$101-200,潮州菜/火鍋,任點、任食、任飲,荃灣眾安街55號大鴻輝(荃灣)中心16樓全層
勝記海鮮酒家,Sing Kee Seafood Restaurant,4,$201-400,粵菜 (廣東)/海鮮/海鮮酒家,店家煮鮑魚的方式十分獨特，由酥炸到蒸煮，共有數十種。同時推薦古法扣兩頭鮑魚。,西貢西貢大街33-39號地舖
砂煲兄弟,Casserole Buddies,4,$51-100,粵菜 (廣東)/港式/中菜館/茶餐廳/冰室,,將軍澳重華路8號東港城1樓101號舖
生昌潮州海鮮酒家,Sun Cheong,3.5,$101-200,潮州菜/海鮮酒家,,大圍下徑口村151號地下 (田心警署對面)
清心齋,,4,$50以下,粵菜 (廣東)/素食,,將軍澳常寧路2號TKO Gateway地下Food Lane EF11號舖
好湯好麵,Hao Tang Hao Mian,4,$51-100,粵菜 (廣東)/港式/粉麵/米線,一碗湯麵，關鍵是要有好的湯底再加上好食材就好像有了靈魂一樣，令人一試難忘！,大圍積存街20號地舖
豚道樂,Butadouraku,3.5,$51-100,日本菜/拉麵,,荃灣大河道63號卓明大廈地舖
稻八日式火鍋炸物放題,Inahachi Shabu Shabu,4,$101-200,日本菜/火鍋/日式放題/咪嘥嘢食店,供應日式火鍋，設九洲豬骨、北海道牛乳等多個日式火鍋湯底。較為特別的是，餐廳設有自助炸物鍋，客人可揀選心水炸物款式後，再自行蘸上炸漿及米糠，放入鍋內炸約20秒左右就製成天婦羅。另有海苔、咖喱等天婦羅調味粉供應。,大埔舊墟直街4-20號美新大廈地下A2號舖
初見,Shoken,4,$51-100,日本菜/火鍋/烤肉/壽司/刺身/日式西餐,,荃灣海壩街22號華達樓地下F號舖
一糖,Idou Dessert,4,$51-100,港式/日本菜/甜品/糖水/中式糖水,位於獨立屋的小店，甜品款式多元化，有日式甜品如紫薯窩夫及綠茶心太軟，也有港式甜品如芒果腸粉。店外的塗鴉更適合文青拍照。,天水圍屏山上璋圍249號地下1號舖
芝加哥串燒酒場,Dragon BBQ Bar,4.5,$101-200,港式/日本菜/串燒/居酒屋,位於大埔的串燒酒場，提供多款手工啤酒，招牌串燒包括鹽燒牛舌、碳燒羊架、碳燒豬頸肉及風味羊肉串等。,大埔翠樂街11號美豐花園地下10號舖
逸之燒,Ichi Grill Shabu Shabu,4.5,$201-400,日本菜/火鍋/壽司/刺身/串燒,主打日式串燒的餐廳，裝潢走和式簡樸風。餐廳食物多元化，手卷、刺身、串燒、壽喜燒等都有，當中又以燒蟹腳、鹽燒雞翼及汁燒魷魚筒最為推介。,元朗鳳攸南街9號好順利大廈2座商場地下 57 號舖
校長燒肉日韓料理,,3.5,$101-200,韓國菜/日本菜/烤肉/自助餐,,元朗西菁街23號K Plus地下G19-24號舖
極尚大瀛喜日本料理,Deluxe Daieiki Japanese Restaurant,4,$201-400,日本菜/日式放題,,元朗朗日路9號形點1期2樓2001A舖
鳥山名,Toriyamana,4,$201-400,日本菜/拉麵/壽司/刺身/烏冬/串燒,,荃灣青山公路荃灣段398號愉景新城1樓1025-1026號舖
和拉麵,,4,$51-100,日本菜/拉麵,,大埔運頭街20-26號廣安大廈地下J號舖
滿屋日本料理,Manya Japanese Restaurant,3.5,$201-400,日本菜/日式放題,,荃灣眾安街55號大鴻輝(荃灣)中心10樓
泰海鮮,Seafood Thai,4,$201-400,泰國菜/海鮮/海鮮酒家,,屯門三聖街6號三聖商場地下5-8及14-16舖
魚一壽司,Sakara ichi sushi,4,$51-100,日本菜/壽司/刺身,,元朗教育路68號兆豐樓地下7號舖
拉麵台風,Ramen Taifu,3.5,$51-100,日本菜/拉麵,以魚介湯拉麵做主打的拉麵店，招牌沾麵每日限量供應，店中服務亦大受客人讚賞，店主歡迎客人追加各種要求。,荃灣大河道81號寶成樓地下7號舖
木船,Wooden boat,4,$51-100,港式/泰國菜/多國菜/茶餐廳/冰室,,大埔太和路34號翠怡花園地下
PizzaExpress,,3.5,$101-200,意大利菜/薄餅/無肉餐單,,東涌達東路20號東薈城名店倉地下G21號舖
Rainbow Cafe,,3.5,$50以下,西式/甜品/糖水/薄餅/咖啡店,,長洲新興海旁街63號地下
Beef & Liberty,,4,$101-200,英國菜/西式/漢堡包,,赤鱲角暢達路1號香港國際機場機場客運大樓(禁區) 第7層離港層東大堂7E138號舖
島中坊研,Island Workbench,4,$50以下,西式/咖啡店,,長洲中學路16號地下
Délifrance,,3.5,$51-100,法國菜/麵包店/三文治/沙律/咖啡店/咪嘥嘢食店,,赤鱲角香港國際機場一號客運大樓5樓抵港層接機大堂(非禁區)
Figos,,4,$201-400,西式/薄餅/西餐廳,,愉景灣D'Deck地下G07號舖
農舍,Green Cottage,4,$50以下,西式/素食/咪嘥嘢食店,,南丫島榕樹灣大街26號地下
The Pink Pig Music Bar and Restaurant,,4,$51-100,西式/多國菜/咖啡店/小食店,,長洲建新里11號地下
中國熊,China Bear,4,$51-100,意大利菜/酒吧,,大嶼山梅窩銀運路3號梅窩中心地下
艾堡餐廳,Eggenberg Island Café & Bar,3.5,$101-200,德國菜,,長洲東灣路85號地舖
甜Mi Mi,Sweet Mi Mi,4,$50以下,西式/甜品/糖水,,長洲新興街45號地舖
Shelly Cake Express,,3.5,$51-100,港式/西式/西式糕點 /咖啡店,,南丫島榕樹灣後街21號地下C舖
Hideout Cafe Bar,,4,$51-100,西式/All Day Breakfast/咖啡店,,南丫島榕樹灣大街77號地下
意大利餐廳,"Resto Restaurant, Pizza, Pasta, Ribs & Grill",3.5,$101-200,意大利菜,,東涌東涌海濱路海堤灣畔商場地下
彼得意大利薄餅,Fresh Basil Pizzeria,4,$50以下,意大利菜/薄餅,,長洲大興堤路19號地下
燒肉時代,Korea BBQ Time,4,$101-200,韓國菜/韓燒,,東涌富東街6號富東廣場1樓110C號舖
金泰屋,Come Thai House Thai Food Restaurant & Bar,3.5,$101-200,泰國菜/咖喱/串燒,,東涌黃泥屋村1號
故鄉俱樂部,Hometown Members Club,3.5,$50以下,日本菜/小食店,,長洲教堂路17號地下
芽莊越式料理,Nha Trang Vietnamese Cuisine,3.5,$101-200,越南菜,,東涌達東路20號東薈城名店倉地下G25號舖
Koh Tomyums,,4,$101-200,泰國菜/咖喱,,愉景灣D'Deck1樓105B號舖
元気寿司,Genki Sushi,3.5,$101-200,日本菜/壽司/刺身/迴轉壽司店,,東涌東堤灣畔3座地下25號舖
空港居酒屋,Airport Izakaya,3.5,$201-400,日本菜/壽司/刺身/酒店餐廳,空港居酒屋的鐵板燒、日式吉列菜式及空運新鮮刺身馳名。同時亦提供爐端燒、串燒、烏冬、壽司及天婦羅等佳餚，以及日本和其他國家的啤酒、日本清酒及特飲。客人可以在壽司，鐵板燒或天婦羅吧，欣賞廚師準備美味佳餚。餐廳有兩個貴賓房的私人活動或商務聚會。,赤鱲角暢達路9號富豪機場酒店地下
清邁泰式料理,Chiang Mai Thai Food,4,$51-100,泰國菜,"泰國廚師親自處理,位於長洲碼頭附近步行只需5分鐘。設有露天座位",長洲北社海傍路17A地下
味千拉麵,Ajisen Ramen,3.5,$51-100,日本菜/拉麵,,東涌富東邨富東商場地下2-3號舖
韓一館,First Korean Restaurant,4,$101-200,韓國菜,,愉景灣D’Deck 1樓102B舖
泰潮,,3.5,$51-100,泰國菜,,赤鱲角香港國際機場二號客運大樓5樓(非禁區)
美談韓國,Mi Dam Korean BBQ Restaurant,3.5,$101-200,韓國菜/烤肉/韓式炸雞,,東涌達東路花園
新羅寶韓國餐廳,Sorabol Korean Restaurant,3.5,$201-400,韓國菜/烤肉/韓燒,"新羅寶韓國餐廳提供傳統韓國料理,客人可選擇韓式鐵板燒或是火鍋。其海鮮及蔬菜均每星期由韓國空運送到。",赤鱲角香港國際機場二號客運大樓翔天廊5樓(非禁區)
Food Tree Korean Cuisine,,3.5,$51-100,韓國菜/快餐店,,東涌海濱路12號藍天海岸地下9D舖
饗和民,KYO Watami,3.5,$101-200,日本菜/壽司/刺身,,東涌達東路20號東薈城名店倉地庫1樓B13號舖
Spark Bar & Restaurant,,4,$201-400,意大利菜/法國菜/海鮮/酒吧/蠔吧,,中環蘭桂坊雲咸街29號LKF 29 4樓
DK Cuppa Tea,,4,$201-400,西式/咖啡店,由香薰品牌開設，提供一系列主題下午茶 、有機茶、咖啡、輕食和甜點，讓客人盡情放鬆，致力打造繁華都市中的綠州。,上環新街市街19號地舖
Ember,,4.5,$201-400,西式/酒吧,,銅鑼灣告士打道229-230號宇宙商業大廈地舖
Chez Bistro,,4.5,$201-400,西式/多國菜/西餐廳,,銅鑼灣耀華街3號百樂中心21樓
Barg,,4,$201-400,意大利菜/西式,體會歐陸美食文化、感受美酒佳餚的喜悅，為三五知己共聚暢飲聚餐的理想之地。主廚經驗豐富，精心挑選最佳食材，每日速運新鮮時令海產。店內裝潢時尚簡約、座位寬敞舒適及悠揚音樂，務求令每位顧客盡情享受用餐的生活品味！,銅鑼灣耀華街3號百樂中心1樓
La Postre,,4,$201-400,西班牙菜/甜品/糖水,有四間分店的西班牙菜餐廳，環境舒適優雅，不時推出時令主題菜式，招牌菜為芝士煎蟹餅、西班牙豬手及麻糬窩夫。,上環永樂街50號昌盛大廈3樓
Glasshouse,,3.5,$101-200,泰國菜/西式,用創新手法演繹傳統烹飪的藝術，通過的香料、食材的刺激，構成新潮流。菜單由分享小食、沙拉和輕量主菜組成，朋友之間和家庭分享輕鬆的用餐體驗。所有菜式結合香港本地，亞太區域和國際食材和配料。,中環港景街1號國際金融中心4樓4009號舖
The Point,,4,$101-200,意大利菜/薄餅/沙律,糅合意大利和美國加州的煮食風格，以自選Pizza、沙律及意粉為主。,銅鑼灣登龍街52號地舖
The Stadium,,4.5,$101-200,美國菜/薄餅/扒房/酒吧/主題餐廳,"以足球、欖球等球類運動為主題的餐廳，面積超過7,000多呎餐廳，除了有電視可觀賞英超、歐聯等足球賽事外，還有掟鏢機、桌球枱、足球機等，很適合大班朋友的聚會。",銅鑼灣波斯富街48號軒尼詩大廈2樓
Mini Club,,4,$201-400,西式/酒/海鮮/酒吧/蠔吧,樓上酒吧，中間有一個反轉的巴黎鐵塔，裝修富有情調。提供多款西餐，海鮮拼盤和生蠔都是食家推介。,銅鑼灣駱克道487-489號駱克駅1樓
Amici,,4,$401-800,意大利菜/西式/Fine Dining/扒房,中環意大利餐廳，裝修富歐陸情調，浪漫優雅。食物水準平均，晚市套餐性價比高。,中環士丹利街11號Stanley 11 8樓
FRITES Belgium on Tap,,4,$201-400,比利時菜/西餐廳,,銅鑼灣希雲街38號曦巒地下1號舖
La Crêperie,,4,$101-200,法國菜/甜品/糖水/無肉餐單/親子餐廳,主打以蕎麥麵粉為原料的法式鹹薄餅，亦有供應其他法國道地美食。,銅鑼灣駱克道459-461號The L. Square 8樓
CIAK - All Day Italian,,4,$201-400,意大利菜/麵包店/雪糕/乳酪/薄餅,2017年首奪米芝蓮車胎人推介的意大利菜餐廳，由米芝蓮三星大廚Bombana擔任總廚顧問，主打家庭式Pizza、自家製手工意粉、麵包同甜品等等。,太古太古城道18號太古城中心2樓265號舖
Neighbor,,4,$101-200,意大利菜/西式/扒房,,銅鑼灣邊寧頓街5號地鋪
Taco Chaca,,4,$51-100,美國菜/墨西哥菜/小食店,,西環西營盤第二街119號地下
Cali-Mex Bar & Grill,,3,$101-200,美國菜/墨西哥菜,,西環堅尼地城吉席街70號地下
El Charro Mexican Cantina,,3.5,$201-400,墨西哥菜/素食/串燒/西餐廳/串燒店,,薄扶林數碼港道100號數碼港商場2樓208號舖
Agave Wan Chai,,3,$201-400,墨西哥菜/酒吧,"Agave Wanchai 是一間提供墨西哥美食的酒吧, 亦有著名的墨西哥仙人掌, 窗口的位置是自然風位, 充滿墨西哥風情。Agare提供品種繁多的高品質的龍舌蘭酒，提供外國進口的食材製作傳統風味佳饌。為保持墨西哥風格，店內的裝飾擁有充滿活潑的色彩，大膽地創造一個休閒又熱情的氣氛，吸引喜歡食物和樂趣的本地和外籍客人，當然還有龍舌蘭！",灣仔駱克道93號地下C&D舖
Grab,,4,$51-100,美國菜/墨西哥菜/三文治/果汁/沙律,,上環永樂街1-3號世瑛大廈13樓1301室
Cali-Mex Bar & Grill,,3.5,$101-200,美國菜/墨西哥菜,,北角電氣道183號地下
El Macho,,,$51-100,墨西哥菜/社企餐廳,,西環西營盤第三街1號地下
Agave,,4,$201-400,墨西哥菜/酒吧,,中環荷李活道26號地舖
Cali-Mex Bar & Grill,,4,$101-200,美國菜/墨西哥菜,,中環德己立街21號地下
Xoco Mexican Resturant,,4,$101-200,墨西哥菜/西餐廳,,半山摩羅廟街31-37號樂欣大廈地下2號舖
Cali-Mex Bar & Grill,,3.5,$101-200,美國菜/墨西哥菜,,西環西營盤高街48號地下
香港雪茄,Hong Kong Cigar,,$51-100,古巴菜/會所,,銅鑼灣駱克道520號2樓
Cali-Mex Taqueria,,,$101-200,美國菜/墨西哥菜/快餐店,,金鐘金鐘道88號太古廣場二期LG1樓Great Food Hall
豪醇紅酒雪茄會,Hou Soen Wine & Cigar Club,,$101-200,古巴菜/酒/會所,,銅鑼灣駱克道541號2樓
乾隆古巴雪茄品味,Kinlonz Club,,$101-200,古巴菜/酒/會所,提供盡百類古巴咖啡以及各類雞尾酒供客人品嘗。,銅鑼灣駱克道521號2樓
重慶劉一手火鍋店,Liu Yi Shou Chong Qing Hot Pot,4,$201-400,川菜 (四川)/火鍋,,銅鑼灣渣甸街66號Aura on Pennington地下及1樓
老虎堂黑糖專売,Tiger Sugar,3.5,$50以下,台灣菜/台式飲品,來自台灣的人氣黑糖珍珠茶飲店，招黑糖波霸鮮奶的虎紋賣相，相當吸睛，適合打卡。,銅鑼灣渣甸街36號地下3號舖
1963 木十豆寸,,3.5,$101-200,台灣菜/中菜館/主題餐廳,裝修具懷舊特色的台灣菜餐廳，招牌菜為紅燒牛肉麵及滷肉飯。,灣仔灣仔道110號中匯大樓2樓
北京老家,Beijing Home,4,$101-200,京菜 (官府菜)/湯品/雲吞/餃子/中菜館,,灣仔皇后大道東183號合和中心7樓704及8樓802號舖
正宗上海生煎皇,,4,$50以下,滬菜 (上海)/雲吞/餃子/中式包點/少鹽少糖食店/名人店,前歌手藝人蕭潤邦開設的上海生煎包店，曾親身跟上海師傅學師。招牌生煎包皮薄多汁，也有供應小籠包及各式飯麵。,銅鑼灣登龍街41號地舖
十二味,Twelve Flavors,4,$101-200,川菜 (四川)/中菜館,,西環堅尼地城山市街10-14號山市樓地下1-3號舖
古琴雅苑,Zither Garden,4,$101-200,京菜 (官府菜)/淮揚菜/中菜館,主打北京填鴨的中菜館，每隻烤鴨能切出108片，皮脆肉嫩，再配上哈蜜瓜、自家製蜂蜜黃梅醬、京葱及青瓜等配料。,灣仔皇后大道東202號QRE Plaza 19樓
四姐川菜,Sijie Sichuan Restaurant,4.5,$201-400,川菜 (四川)/水煮菜式/私房菜,,灣仔告士打道171-172號安邦商業大廈1樓
雲長小龍坎老火鍋,,4,$201-400,川菜 (四川)/火鍋/名人店,歌手陳柏宇開設的麻辣火鍋店。於內地有多間分店的人氣火鍋店，主打麻辣火鍋，招牌麻辣湯底富牛油香且帶甜味。,銅鑼灣記利佐治街1號金百利廣場7樓R3室
玖五牛肉麵,Jiu-Wu Beef Noodle,3.5,$51-100,台灣菜/粉麵/米線/名人店,由名人何超蓮開設，品牌來自台灣，有超50年歷史，牛肉麵湯底以美國牛骨及藥材熬煮超過48小時，帶有濃郁藥材味。,銅鑼灣駱克道399號金禧大廈地舖
利寶閣,Star Of Canton,4,$201-400,粵菜 (廣東)/海鮮/點心/酒樓/少鹽少糖食店,,上環德輔道中199號無限極廣場2樓
源記甜品專家,Yuen Kee Dessert,3.5,$50以下,粵菜 (廣東)/港式/中式糖水/糖水舖,"源記甜品專家,一間老字號的糖水鋪,店內售賣的是中國的傳統甜湯,更以杏仁露,合桃露和桑寄生出名.每選糖水亦可以配以蓮子/蛋.再加上上全雞蛋蛋糕.是飯後的良好選擇.",西環西營盤正街32號地下
坤記煲仔小菜,,3.5,$51-100,粵菜 (廣東)/中菜館,由舊鋪遷往現時新店，雖然位置和裝修不同，但同樣保持了原有以煲仔菜及煲仔飯聞名，雖然遷新店，但可惜座位不多，經常爆滿，所以訂位請早。,西環西營盤皇后大道西263號和益大廈地下1號舖
名門私房菜,Charisme Pavillion,4,$201-400,粵菜 (廣東)/海鮮/山珍海味/私房菜,,灣仔灣仔道83號2樓
蓮香居,Lin Heung Kui,3.5,$101-200,粵菜 (廣東)/粉麵/米線/粥品/點心/中式包點/酒樓,蓮香居仍然保留舊式點心車，早午茶市人流不絕。晚市廣東小菜亦甚有傳統風味，招牌菜為霸王蓮香鴨。,上環德輔道西46-50號2-3樓
太元樓,Tai Yuen Lou,4.5,$101-200,粵菜 (廣東)/京川滬/中菜館,,北角電氣道233號城市花園1，2及3座部分平台地下 24-49號A及C號舖
東寶小館,Tung Po,3.5,$101-200,粵菜 (廣東)/海鮮/大牌檔,喝啤酒的碗很有特色，炸榴槤、炸雙卜及雙蝦會是必點菜式。,北角渣華道99號渣華道市政大廈2樓
香港華商銀行公會,The Chinese Banks' Association Ltd,4,$101-200,粵菜 (廣東)/中菜館,,中環雲咸街1號南華大廈5樓
沾仔記,Tsim Chai Kee Noodle,3.5,$50以下,粵菜 (廣東)/粉麵/米線,雲吞和牛肉是招牌菜，價格大眾化，裝潢則帶有鄉土氣息。,中環威靈頓街98號地舖
勝記酒家,Sing Kee Restaurant,4,$101-200,粵菜 (廣東)/酒樓,,灣仔杜老誌道6號群策大廈3樓
德記潮州菜館,Tak Kee Chiu Chou Restaurant,3.5,$101-200,潮州菜/中菜館,,西環堅尼地城卑路乍街3號G益豐大廈地下
籠太子點心專門店,Prince Dragon Dim Sum,4,$50以下,粵菜 (廣東)/港式/點心/中式包點,,銅鑼灣蘭芳道11號地舖
新興食家,Sun Hing Restaurant,3.5,$50以下,粵菜 (廣東)/點心,西環人的夜茶店，其流沙包遠近馳名，早上店外會出現大條人龍，店內有人手叫賣點心，本土味道濃厚。,西環堅尼地城士美非路8號地下C號舖
東園酒家宴會廳,Tung Yuen Banquet,4,$51-100,粵菜 (廣東)/港式/山珍海味/燒臘/點心,,灣仔軒尼詩道71-85號熙華大廈地下及1樓
奈良上釜,Kamameshi,4,$101-200,日本菜,一間以日式釜飯為主打的日本料理，招牌菜為期間限定的蟹盛，以松葉蟹製作茶碗蒸及天婦羅，再以蟹肉、蟹膏及蟹籽拌飯，鮮味無窮。,銅鑼灣登龍街39號地舖
甘牌燒鵝,Kam's Roast Goose,3,$51-100,粵菜 (廣東)/燒臘/中菜館,以祖傳秘方烹煮燒鵝，價格親民。餐廳僅有30個座位，客人經常需要排隊。,灣仔軒尼詩道226號寶華商業中心地舖
Mee...lemongrass,,4,$51-100,泰國菜/馬來西亞菜/咖喱/串燒/沙律,,銅鑼灣告士打道311號皇室堡地庫B11號鋪
吉列牛忌廉烏冬專門店,Kobekyu,4,$101-200,韓國菜/日本菜/拉麵/烏冬,來自韓國的吉列牛專門店，主打吉列牛及忌廉烏冬。您可以自己燒牛肉，控制生熟度。,銅鑼灣耀華街3號百樂中心22樓
Fûhn,,4,$51-100,越南菜/粉麵/米線,,銅鑼灣駱克道459-461號The L. Square 1樓
滿屋日本料理,Manya Japanese Restaurant,4,$201-400,日本菜/日式放題,晚市放題供應多款食物，如刺身、壽司及炸物等。特別提供一般放題少見的朱古力噴泉、爆谷機及棉花糖機。食客更可任飲清酒、梅酒及啤酒。,銅鑼灣駱克道463-483號銅鑼灣廣場二期8樓
勝八居酒屋,Katsuhachi,4,$201-400,日本菜/壽司/刺身/串燒/居酒屋,提供各式新鮮刺身及日式燒物，蟹膏滿滿的甲羅燒幾乎是必選之食。另有多款燒酌及清酒。,銅鑼灣登龍街28號永光中心11樓
Steak Bar,,4,$201-400,日本菜/扒房,主打牛扒的日式小店，店內有多款牛肉選擇，包括吉列炸牛扒、石燒薄切牛肉等，頂級板腱牛扒更是每日限量供應。,銅鑼灣登龍街36-48號登輝大廈地下B號舖
新麻蒲 BBQ,Shin Mapo BBQ,4,$101-200,韓國菜/烤肉,新麻浦BBQ在韓國已有超過 400 間分店，而香港店亦有有韓國廚師駐場，保證味道夠正宗。,銅鑼灣波斯富街24-30號寶漢大廈2樓
備長,Bicho,4,$201-400,日本菜/串燒/居酒屋,此店以日式串燒為主打，有多款串燒以供選擇。此外，荔枝豬肉卷及燒羊扒亦十分馳名。,銅鑼灣軒尼詩道525號澳門逸園中心26樓
築地日本料理,Tsukiji Japanese Restaurant,4,$101-200,日本菜/壽司/刺身/烏冬,居酒屋格調日本餐廳，有海鮮缸每日供應新鮮海鮮，另有特色全素「素心司」套餐供應，菜式配搭富心思。,銅鑼灣記利佐治街1號金百利廣場7樓R1室
Goobne Chicken,,4,$101-200,韓國菜/韓式炸雞,韓國第一烤雞品牌，烤雞不經油炸，利用韓式焗爐以烤焗方式將雞肉內的油分逼出，令烤雞比起一般炸雞少油、低熱量、低膽固醇，更設不同口味。,中環威靈頓街2-8號威靈頓廣場M88 5樓
Samsen 泰麵,,4,$101-200,泰國菜/粉麵/米線,榮獲米芝蓮推介的泰國船麵餐廳，舖面不大但人氣甚高。招牌和牛船麵湯底濃郁清甜，牛肉腍滑，粉麵口感彈牙。,灣仔石水渠街68號地下
Siam 28,,4,$101-200,泰國菜/海鮮/咖喱,,銅鑼灣軒尼詩道525號澳門逸園中心28樓
京林屋,Kyo Hayashiya,4,$51-100,日本菜/甜品/糖水,於京都有過百年歷史的抹茶老店，抹茶賣點以手打製作，供應抹茶蕨餅、林屋抹茶芭菲及特濃焙茶雪山等一系列抹茶名物，此店為最優秀灣仔/銅鑼灣開飯熱店及最優秀開飯甜品店入圍餐廳。,銅鑼灣軒尼詩道500號希慎廣場12樓1203號舖
吃吧,Chiba,4,$101-200,西式/多國菜/酒吧,,旺角彌敦道566-568號僑建大廈2樓2室
慢煮工業,Under Vacuum The Steak,4,$101-200,西式/三文治/All Day Breakfast/咖啡店,,太子太子道西91號地舖
Urban Coffee Roaster,,4,$101-200,西式/All Day Breakfast/咖啡店,精品咖啡店，用的是自家烘焙的咖啡豆。亦有供應沙律、意粉、漢堡及意大利飯等主食。,尖沙咀碧仙桃路7號美麗都大廈地下44號舖
Candies Foodies,,4,$101-200,西式/咖啡店,,尖沙咀樂道36-50號華源大廈1B-2B閣樓
MGB by Manhattan Grill & Bar,,4,$201-400,美國菜/酒吧,餐廳面積很大，設有戶外區域。另有生蠔即開即食。,觀塘觀塘道414號一亞太中心(OPC)3樓303號舖
Go Inside Kitchen,,4,$101-200,意大利菜/西式,位於工廈內的西餐廳，Go Inside表意是請人內進，語帶相關的另一個意思是提醒人們重返本心，讓人聆聽自己內心聲音，重拾追求夢想的熱情，為一個孵化不同年青人的夢想實踐咖啡店，鼓勵年青人「做。真自己Being Truth to Yourself」。,觀塘觀塘道404號時運工業大廈5樓D室
慢理牆城,Wall Is Eat,4,$101-200,西式/甜品/糖水/酒店餐廳,位於旺角砵蘭街M1酒店內，以超級食物為主要食材，烹調不同款式的健康食品及飲料。餐廳以森林為主題，配搭原木及綠色做主調，讓食客猶如置身於石屎森林中的一片綠洲。,油麻地砵蘭街28號M1酒店1樓
Cosmos Restaurant & Bar,,4,$101-200,西式/海鮮/扒房/酒吧,頗有情調的西餐廳，供應多國菜色，晚餐配上燭光氣氛浪漫，適合情侶約會。,尖沙咀寶勒巷27號東滙商業大厦地舖
The Grill Room,,4,$201-400,西式/扒房,,尖沙咀堪富利士道6-6A號爵寓2樓
Fifty Fifty,,4,$51-100,意大利菜/西式/All Day Breakfast/扒房/咖啡店/咪嘥嘢食店,,長沙灣東沙島街青山道181號地下C舖
L'attitude,,4,$101-200,西式/多國菜/甜品/糖水/雪糕/乳酪/日式西餐,,尖沙咀金馬倫道19號地下A舖
Home Sweet Home,,4,$101-200,西式/多國菜/海鮮/蠔吧,"美國安格斯55oz斧頭扒,黑松露包糠慢焗原隻三黃雞(提前一天預訂即可)",太子基隆街13號永基樓地舖
Mad for Garlic,,4,$101-200,韓國菜/意大利菜/薄餅,,九龍塘達之路80號又一城1樓L1-34號舖
CHOO CHOO,,4,$101-200,西式/甜品/糖水/沙律/酒吧/主題餐廳,以火車做主題的餐廳，食客用餐就如置身於火車車卡一樣。LJK乃必試之自家製甜品。,長沙灣順寧道364-368號昌暉大廈地下1號舖
Rimi Cafe,,4,$51-100,西式/樓上cafe,,旺角登打士街43H號登打士廣場20樓全層
適泊魚燒,Stayplus Bakery,3.5,$50以下,台灣菜/麵包店/小食店/露天茶座,,長洲北社二里 1A 地下
金銘潮州粉麵,,3.5,$50以下,潮州菜/粉麵/米線/雲吞/餃子,,東涌逸東街8號逸東邨街市地下
翡翠拉麵小籠包,Crystal Jade La Mian Xiao Long Bao,3,$101-200,滬菜 (上海)/拉麵/中菜館/咪嘥嘢食店/少鹽少糖食店,來自新加坡的連鎖上海菜館，2002年進軍香港，將傳統上海菜口味改良，菜式較清淡。,赤鱲角香港國際機場一號客運大樓5樓抵港接機大堂T160號舖(非禁區)
華都海鮮酒家,Wah Tao Restaurant,3,$101-200,粵菜 (廣東)/海鮮/中菜館,日落靚景，新鮮漁獲，可享受近距離靠岸用餐的感覺。專營游水海鮮，惹味小炒，家鄉小菜，專車接送，歡迎訂枱！,東涌舊碼頭2號
潮樓,Chao Inn,3,$101-200,潮州菜/點心/中菜館/酒樓,,赤鱲角香港國際機場二號客運大樓翔天廊6樓(非禁區)6P033號舖
美心.翠園,Maxim's Jade Garden,3,$101-200,粵菜 (廣東)/點心/雲吞/餃子/中式包點/酒樓,,赤鱲角香港國際機場一號客運大樓8樓離港大堂夾層(非禁區)
富記海鮮酒家,Fu Kee Seafood Restaurant,4,$101-200,粵菜 (廣東)/海鮮/中菜館/海鮮酒家,,南丫島索罟灣第一街9-10號地下
和樂餐廳,,4,$50以下,港式/台灣菜/拉麵/粉麵/米線/薄餅/咖喱/茶餐廳/冰室,,長洲大新街81號地下
